{
  "schema_version": "3.0",
  "document": "Rückverfolgbarkeit (abgeleitet)",
  "requirements": [
    {
      "id": "REQ-ECO-001",
      "tests": [
        "T-CALC-COST-001",
        "T-SEM-COST-001",
        "T-PKG-RENDER-001"
      ],
      "tests_known": true,
      "stage": "BS-00",
      "status": "IM_PAKET_NACHGEWIESEN",
      "basis": "§5.1, R-04, EV-01"
    },
    {
      "id": "REQ-ECO-002",
      "tests": [
        "T-CALC-DMC-001"
      ],
      "tests_known": true,
      "stage": "BS-00",
      "status": "IM_PAKET_NACHGEWIESEN",
      "basis": "§5.6, EV-03"
    },
    {
      "id": "REQ-ECO-003",
      "tests": [
        "T-CALC-DMC-002",
        "T-GATE-001"
      ],
      "tests_known": true,
      "stage": "BS-00",
      "status": "IM_PAKET_NACHGEWIESEN",
      "basis": "§5.5, EV-04"
    },
    {
      "id": "REQ-ECO-004",
      "tests": [
        "T-GATE-001"
      ],
      "tests_known": true,
      "stage": "BS-05",
      "status": "IM_PAKET_NACHGEWIESEN",
      "basis": "§5.8"
    },
    {
      "id": "REQ-ECO-005",
      "tests": [
        "T-CALC-TAX-001",
        "T-SEM-TAX-001"
      ],
      "tests_known": true,
      "stage": "BS-00",
      "status": "IM_PAKET_NACHGEWIESEN",
      "basis": "§5.3, BQ-03, EV-02"
    },
    {
      "id": "REQ-ECO-006",
      "tests": [
        "T-CALC-DMC-001"
      ],
      "tests_known": true,
      "stage": "BS-00",
      "status": "IM_PAKET_NACHGEWIESEN",
      "basis": "§5.4, EV-02"
    },
    {
      "id": "REQ-RES-001",
      "tests": [
        "T-GATE-001",
        "T-CON-001",
        "T-RES-PREREG-001"
      ],
      "tests_known": true,
      "stage": "BS-03",
      "status": "TEILWEISE_NACHGEWIESEN",
      "basis": "§6.4"
    },
    {
      "id": "REQ-RES-002",
      "tests": [
        "T-CALC-STAT-001",
        "T-CALC-STAT-002",
        "T-GATE-001"
      ],
      "tests_known": true,
      "stage": "BS-03",
      "status": "IM_PAKET_NACHGEWIESEN",
      "basis": "§6.4"
    },
    {
      "id": "REQ-RES-003",
      "tests": [
        "T-CALC-OC-001",
        "T-GATE-001",
        "T-SEM-GATE-001"
      ],
      "tests_known": true,
      "stage": "BS-03",
      "status": "IM_PAKET_NACHGEWIESEN",
      "basis": "§6.6, EV-05, DEC-DS-21"
    },
    {
      "id": "REQ-RES-004",
      "tests": [
        "T-SM-001",
        "T-RES-HOLDOUT-001"
      ],
      "tests_known": true,
      "stage": "BS-04",
      "status": "TEILWEISE_NACHGEWIESEN",
      "basis": "§6.4, v2.0"
    },
    {
      "id": "REQ-RES-005",
      "tests": [
        "T-CALC-PRIOR-001"
      ],
      "tests_known": true,
      "stage": "BS-00",
      "status": "IM_PAKET_NACHGEWIESEN",
      "basis": "§6.3"
    },
    {
      "id": "REQ-RES-006",
      "tests": [
        "T-CALC-PRIOR-002",
        "T-GATE-001",
        "T-SEM-PROXY-001"
      ],
      "tests_known": true,
      "stage": "BS-02",
      "status": "IM_PAKET_NACHGEWIESEN",
      "basis": "§6.5, EV-08, DEC-DS-24"
    },
    {
      "id": "REQ-RES-007",
      "tests": [
        "T-STR-TF-001",
        "T-STR-IM-001",
        "T-STR-REV-001",
        "T-STR-CA-001",
        "T-STR-BASE-001",
        "T-STR-EQ-001"
      ],
      "tests_known": true,
      "stage": "BS-05",
      "status": "TEILWEISE_NACHGEWIESEN",
      "basis": "§6.1"
    },
    {
      "id": "REQ-RES-008",
      "tests": [
        "T-CALC-TURN-001",
        "T-GATE-001"
      ],
      "tests_known": true,
      "stage": "BS-03",
      "status": "IM_PAKET_NACHGEWIESEN",
      "basis": "§6.1, BQ-04"
    },
    {
      "id": "REQ-RES-009",
      "tests": [
        "T-GATE-001",
        "T-CON-001"
      ],
      "tests_known": true,
      "stage": "BS-03",
      "status": "IM_PAKET_NACHGEWIESEN",
      "basis": "§6.4"
    },
    {
      "id": "REQ-RES-010",
      "tests": [
        "T-DAT-LEAK-001",
        "T-GATE-001"
      ],
      "tests_known": true,
      "stage": "BS-02",
      "status": "TEILWEISE_NACHGEWIESEN",
      "basis": "§6.4, v2.0"
    },
    {
      "id": "REQ-RSK-001",
      "tests": [
        "T-CALC-LEV-001",
        "T-RISK-GAP-001",
        "T-PTC-013"
      ],
      "tests_known": true,
      "stage": "BS-05",
      "status": "TEILWEISE_NACHGEWIESEN",
      "basis": "§7.4, BQ-04, DEC-DS-10"
    },
    {
      "id": "REQ-RSK-002",
      "tests": [
        "T-SM-001",
        "T-RISK-LADDER-001",
        "T-DRL-005"
      ],
      "tests_known": true,
      "stage": "BS-05",
      "status": "TEILWEISE_NACHGEWIESEN",
      "basis": "§7.5, DEC-DS-01"
    },
    {
      "id": "REQ-RSK-003",
      "tests": [
        "T-SM-001",
        "T-RISK-LADDER-002"
      ],
      "tests_known": true,
      "stage": "BS-05",
      "status": "TEILWEISE_NACHGEWIESEN",
      "basis": "§7.5"
    },
    {
      "id": "REQ-RSK-004",
      "tests": [
        "T-CALC-LEV-001",
        "T-SEM-LEV-001"
      ],
      "tests_known": true,
      "stage": "BS-00",
      "status": "IM_PAKET_NACHGEWIESEN",
      "basis": "§7.3, D3-02"
    },
    {
      "id": "REQ-RSK-005",
      "tests": [
        "T-CALC-KELLY-001"
      ],
      "tests_known": true,
      "stage": "BS-00",
      "status": "IM_PAKET_NACHGEWIESEN",
      "basis": "§7.4"
    },
    {
      "id": "REQ-RSK-006",
      "tests": [
        "T-CALC-STRESS-001",
        "T-SEM-STRESS-001"
      ],
      "tests_known": true,
      "stage": "BS-00",
      "status": "IM_PAKET_NACHGEWIESEN",
      "basis": "§7.9"
    },
    {
      "id": "REQ-RSK-007",
      "tests": [
        "T-RISK-MRG-001",
        "T-SM-001",
        "T-DRL-005"
      ],
      "tests_known": true,
      "stage": "BS-05",
      "status": "TEILWEISE_NACHGEWIESEN",
      "basis": "§7.7, EV-09"
    },
    {
      "id": "REQ-RSK-008",
      "tests": [
        "T-SM-001",
        "T-RISK-STEP-001"
      ],
      "tests_known": true,
      "stage": "BS-05",
      "status": "TEILWEISE_NACHGEWIESEN",
      "basis": "§7.8, RK-06"
    },
    {
      "id": "REQ-RSK-009",
      "tests": [
        "T-KILL-001",
        "T-DRL-010",
        "T-SM-001"
      ],
      "tests_known": true,
      "stage": "BS-05",
      "status": "TEILWEISE_NACHGEWIESEN",
      "basis": "§7.5, §8.5"
    },
    {
      "id": "REQ-RSK-010",
      "tests": [
        "T-PKG-VAL-001",
        "T-SEM-LIM-001"
      ],
      "tests_known": true,
      "stage": "BS-00",
      "status": "IM_PAKET_NACHGEWIESEN",
      "basis": "§7.5, R-04"
    },
    {
      "id": "REQ-RSK-011",
      "tests": [
        "T-RISK-NAV-001"
      ],
      "tests_known": true,
      "stage": "BS-05",
      "status": "SPEZIFIZIERT",
      "basis": "§3.2"
    },
    {
      "id": "REQ-RSK-012",
      "tests": [
        "T-PTC-007",
        "T-SEM-CAP-001"
      ],
      "tests_known": true,
      "stage": "BS-05",
      "status": "TEILWEISE_NACHGEWIESEN",
      "basis": "§7.5, DEC-DS-18"
    },
    {
      "id": "REQ-RSK-013",
      "tests": [
        "T-RISK-COV-001"
      ],
      "tests_known": true,
      "stage": "BS-05",
      "status": "SPEZIFIZIERT",
      "basis": "§7.1, RK-07"
    },
    {
      "id": "REQ-RSK-014",
      "tests": [
        "T-RISK-SIZE-001",
        "T-CON-001"
      ],
      "tests_known": true,
      "stage": "BS-05",
      "status": "TEILWEISE_NACHGEWIESEN",
      "basis": "§7.4, v2.0"
    },
    {
      "id": "REQ-EXE-001",
      "tests": [
        "T-EXE-001",
        "T-EXE-002",
        "T-SM-001"
      ],
      "tests_known": true,
      "stage": "BS-05",
      "status": "TEILWEISE_NACHGEWIESEN",
      "basis": "§8.1, v2.0"
    },
    {
      "id": "REQ-EXE-002",
      "tests": [
        "T-EXE-003",
        "T-SM-001",
        "KT-05"
      ],
      "tests_known": true,
      "stage": "BS-05",
      "status": "TEILWEISE_NACHGEWIESEN",
      "basis": "§8.1, v2.0, RK-10"
    },
    {
      "id": "REQ-EXE-003",
      "tests": [
        "T-SM-001",
        "T-CON-001",
        "T-EXE-004"
      ],
      "tests_known": true,
      "stage": "BS-05",
      "status": "TEILWEISE_NACHGEWIESEN",
      "basis": "§8.1, v2.0"
    },
    {
      "id": "REQ-EXE-004",
      "tests": [
        "T-SM-001",
        "T-EXE-005",
        "KT-12"
      ],
      "tests_known": true,
      "stage": "BS-05",
      "status": "TEILWEISE_NACHGEWIESEN",
      "basis": "§8.1"
    },
    {
      "id": "REQ-EXE-005",
      "tests": [
        "T-SM-001",
        "T-CON-001",
        "T-EXE-006",
        "KT-04"
      ],
      "tests_known": true,
      "stage": "BS-05",
      "status": "TEILWEISE_NACHGEWIESEN",
      "basis": "DEC-DS-11"
    },
    {
      "id": "REQ-EXE-006",
      "tests": [
        "T-SM-001",
        "KT-06",
        "T-EXE-007"
      ],
      "tests_known": true,
      "stage": "BS-05",
      "status": "TEILWEISE_NACHGEWIESEN",
      "basis": "DEC-DS-20, CR-5"
    },
    {
      "id": "REQ-EXE-007",
      "tests": [
        "T-SM-001",
        "KT-07",
        "T-EXE-008"
      ],
      "tests_known": true,
      "stage": "BS-05",
      "status": "TEILWEISE_NACHGEWIESEN",
      "basis": "§8.1, v2.0"
    },
    {
      "id": "REQ-EXE-008",
      "tests": [
        "T-SM-001",
        "KT-16",
        "T-DRL-009"
      ],
      "tests_known": true,
      "stage": "BS-05",
      "status": "TEILWEISE_NACHGEWIESEN",
      "basis": "§10.5, v2.0"
    },
    {
      "id": "REQ-EXE-009",
      "tests": [
        "T-ADP-001",
        "KT-15"
      ],
      "tests_known": true,
      "stage": "BS-05",
      "status": "SPEZIFIZIERT",
      "basis": "§8.1"
    },
    {
      "id": "REQ-EXE-010",
      "tests": [
        "T-ADP-002",
        "KT-05"
      ],
      "tests_known": true,
      "stage": "BS-05",
      "status": "SPEZIFIZIERT",
      "basis": "§8.1, RK-10"
    },
    {
      "id": "REQ-EXE-011",
      "tests": [
        "T-ADP-003",
        "KT-03",
        "T-CON-001"
      ],
      "tests_known": true,
      "stage": "BS-05",
      "status": "TEILWEISE_NACHGEWIESEN",
      "basis": "§8.1, RK-11"
    },
    {
      "id": "REQ-EXE-012",
      "tests": [
        "T-SM-001",